{
    "structured_response": {
        "السؤال": "ما عدد البحور الشعرية؟",
        "إعادة الصياغة المبسطة": "كم عدد الأوزان الشعرية المختلفة في علم العروض؟",
        "صياغة بديلة": "ما هو عدد البحور الشعرية المعترف بها في الشعر العربي؟",
        "تلخيص السؤال": "عدد البحور الشعرية.",
        "التفصيل": "في علم العروض، يوجد عدد كبير من البحور الشعرية التي يمكن استخدامها لتنظيم الشعر وتحديد إيقاعه. لا يوجد عدد محدد للبحور الشعرية بشكل قاطع، لكن هناك العديد من البحور المعروفة والمستخدمة بشكل شائع.",
        "استخراج مصطلح رئيسي للتصفية": "عدد البحور الشعرية.",
        "استخراج الكلمات المفتاحية": [
            "عدد",
            "البحور الشعرية",
            "علم العروض",
            "الأوزان الشعرية",
            "الشعر العربي"
        ],
        "عناوين ذات الصلة": [
            "مقدمة",
            "تمهيد",
            "أوزان البحور",
            "البحر الطويل",
            "البحر المديد",
            "البحر البسيط",
            "البحر الوافر",
            "البحر الكامل",
            "البحر الهزج",
            "البحر الرجز",
            "البحر الرمل",
            "البحر السريع",
            "البحر المنسرح",
            "البحر الخفيف",
            "البحر المضارع",
            "البحر المقتضب",
            "البحر المجتث",
            "البحر المتقارب",
            "البحر المتدارك"
        ]
    },
    "full_response": {
        "model_id": "sdaia/allam-1-13b-instruct",
        "created_at": "2024-10-31T08:28:56.757Z",
        "results": [
            {
                "generated_text": " 1. العنوان الأول: السؤال: ما عدد البحور الشعرية؟\n2. العنوان الثاني: إعادة الصياغة المبسطة: كم عدد الأوزان الشعرية المختلفة في علم العروض؟\n3. العنوان الثالث: صياغة بديلة: ما هو عدد البحور الشعرية المعترف بها في الشعر العربي؟\n4. العنوان الرابع: تلخيص السؤال: عدد البحور الشعرية.\n5. العنوان الخامس: التفصيل: في علم العروض، يوجد عدد كبير من البحور الشعرية التي يمكن استخدامها لتنظيم الشعر وتحديد إيقاعه. لا يوجد عدد محدد للبحور الشعرية بشكل قاطع، لكن هناك العديد من البحور المعروفة والمستخدمة بشكل شائع.\n6. العنوان السادس: استخراج مصطلح رئيسي للتصفية: عدد البحور الشعرية.\n7. العنوان السابع: استخراج الكلمات المفتاحية: عدد، البحور الشعرية، علم العروض، الأوزان الشعرية، الشعر العربي.\n8. العنوان الثامن: عناوين ذات الصلة: مقدمة، تمهيد، أوزان البحور، البحر الطويل، البحر المديد، البحر البسيط، البحر الوافر، البحر الكامل، البحر الهزج، البحر الرجز، البحر الرمل، البحر السريع، البحر المنسرح، البحر الخفيف، البحر المضارع، البحر المقتضب، البحر المجتث، البحر المتقارب، البحر المتدارك. ",
                "generated_token_count": 251,
                "input_token_count": 794,
                "stop_reason": "eos_token"
            }
        ],
        "system": {
            "warnings": [
                {
                    "message": "This model is a Non-IBM Product governed by a third-party license that may impose use restrictions and other obligations. By using this model you agree to its terms as identified in the following URL.",
                    "id": "disclaimer_warning",
                    "more_info": "https://dataplatform.cloud.ibm.com/docs/content/wsj/analyze-data/fm-models.html?context=wx"
                }
            ]
        }
    }
}